
shell@android:/ # 
shell@android:/ # 
shell@android:/ # 
?1зы5AGER]:s StatusBar.NetworkControllerDS:s CLOUD_CLIENT:s [PMP_SERVER]:s         <
--------- beginning of /dev/log/system
--------- beginning of /dev/log/main




su


^C
130|shell@android:/ # su
shell@android:/ # 
shell@android:/ # logcat -c;logcat
--------- beginning of /dev/log/main
W/dalvikvm( 1546): JNI: pin count on array 0x4147cbb0 ([B) is now 494
--------- beginning of /dev/log/system
D/WifiP2pService(  993): wait for wifi sta and softap disabled!!
D/MonitorCw880( 1546): counter=10 && isHeartbeatTimeout=false
W/dalvikvm( 1546): JNI: pin count on array 0x4147cbb0 ([B) is now 495
D/WifiP2pService(  993): wait for wifi sta and softap disabled!!
D/dalvikvm( 1158): GC_CONCURRENT freed 689K, 66% free 2511K/7363K, paused 1ms+2ms
D/HomePlayerLib( 1158): hostaddress count is 1
D/dalvikvm( 1158): GC_CONCURRENT freed 673K, 66% free 2528K/7363K, paused 1ms+1ms
D/dalvikvm( 1158): GC_CONCURRENT freed 692K, 66% free 2518K/7363K, paused 1ms+2ms
D/dalvikvm( 1158): GC_CONCURRENT freed 684K, 68% free 2409K/7363K, paused 1ms+2ms
W/dalvikvm( 1546): JNI: pin count on array 0x4147cbb0 ([B) is now 496
D/dalvikvm( 1158): GC_CONCURRENT freed 528K, 66% free 2540K/7363K, paused 1ms+1ms
D/WifiP2pService(  993): wait for wifi sta and softap disabled!!
D/dalvikvm( 1158): GC_CONCURRENT freed 714K, 66% free 2534K/7363K, paused 1ms+2ms
D/dalvikvm( 1158): GC_CONCURRENT freed 699K, 66% free 2541K/7363K, paused 1ms+1ms
D/MonitorCw880( 1546): counter=12 && isHeartbeatTimeout=false
D/dalvikvm( 1158): GC_CONCURRENT freed 691K, 66% free 2555K/7363K, paused 1ms+2ms
W/dalvikvm( 1546): JNI: pin count on array 0x4147cbb0 ([B) is now 497
D/dalvikvm( 1158): GC_CONCURRENT freed 734K, 66% free 2528K/7363K, paused 3ms+1ms
D/WifiP2pService(  993): wait for wifi sta and softap disabled!!
D/dalvikvm( 1158): GC_CONCURRENT freed 679K, 67% free 2432K/7363K, paused 1ms+2ms
D/dalvikvm( 1158): GC_CONCURRENT freed 567K, 66% free 2526K/7363K, paused 1ms+1ms
W/dalvikvm( 1546): JNI: pin count on array 0x4147cbb0 ([B) is now 498
D/dalvikvm( 1158): GC_CONCURRENT freed 696K, 68% free 2406K/7363K, paused 2ms+2ms
D/WifiP2pService(  993): wait for wifi sta and softap disabled!!
D/dalvikvm( 1158): GC_CONCURRENT freed 540K, 66% free 2510K/7363K, paused 1ms+2ms
D/MonitorCw880( 1546): counter=4 && isHeartbeatTimeout=false
D/dalvikvm( 1158): GC_CONCURRENT freed 661K, 66% free 2536K/7363K, paused 1ms+1ms
D/dalvikvm( 1158): GC_CONCURRENT freed 704K, 67% free 2431K/7363K, paused 1ms+2ms
W/dalvikvm( 1546): JNI: pin count on array 0x4147cbb0 ([B) is now 499
D/dalvikvm( 1158): GC_CONCURRENT freed 571K, 68% free 2403K/7363K, paused 1ms+2ms
D/WifiP2pService(  993): wait for wifi sta and softap disabled!!
D/dalvikvm( 1158): GC_CONCURRENT freed 533K, 66% free 2509K/7363K, paused 2ms+1ms
W/dalvikvm( 1546): JNI: pin count on array 0x4147cbb0 ([B) is now 500
D/WifiP2pService(  993): wait for wifi sta and softap disabled!!
D/MonitorCw880( 1546): counter=6 && isHeartbeatTimeout=false
W/dalvikvm( 1546): JNI: pin count on array 0x4147cbb0 ([B) is now 501
D/WifiP2pService(  993): wait for wifi sta and softap disabled!!
W/dalvikvm( 1546): JNI: pin count on array 0x4147cbb0 ([B) is now 502
D/dalvikvm( 1158): GC_CONCURRENT freed 657K, 66% free 2512K/7363K, paused 1ms+1ms
D/WifiP2pService(  993): wait for wifi sta and softap disabled!!
D/dalvikvm( 1158): GC_CONCURRENT freed 664K, 67% free 2430K/7363K, paused 1ms+2ms
D/MonitorCw880( 1546): counter=8 && isHeartbeatTimeout=false
D/dalvikvm( 1158): GC_CONCURRENT freed 557K, 68% free 2428K/7363K, paused 1ms+2ms
D/dalvikvm( 1158): GC_CONCURRENT freed 566K, 67% free 2443K/7363K, paused 1ms+2ms
W/dalvikvm( 1546): JNI: pin count on array 0x4147cbb0 ([B) is now 503
D/WifiP2pService(  993): wait for wifi sta and softap disabled!!
D/dalvikvm( 1158): GC_CONCURRENT freed 581K, 66% free 2531K/7363K, paused 9ms+1ms
W/dalvikvm( 1546): JNI: pin count on array 0x4147cbb0 ([B) is now 504
D/WifiP2pService(  993): wait for wifi sta and softap disabled!!
D/MonitorCw880( 1546): counter=10 && isHeartbeatTimeout=false
W/dalvikvm( 1546): JNI: pin count on array 0x4147cbb0 ([B) is now 505
D/WifiP2pService(  993): wait for wifi sta and softap disabled!!
D/dalvikvm( 1158): GC_CONCURRENT freed 700K, 66% free 2535K/7363K, paused 4ms+1ms
W/dalvikvm( 1546): JNI: pin count on array 0x4147cbb0 ([B) is now 506
D/WifiP2pService(  993): wait for wifi sta and softap disabled!!
D/MonitorCw880( 1546): counter=12 && isHeartbeatTimeout=false
D/dalvikvm( 1158): GC_CONCURRENT freed 700K, 67% free 2430K/7363K, paused 1ms+2ms
D/HomePlayerLib( 1158): hostaddress count is 1
D/dalvikvm( 1158): GC_CONCURRENT freed 571K, 66% free 2527K/7363K, paused 2ms+2ms
D/dalvikvm( 1158): GC_CONCURRENT freed 671K, 66% free 2557K/7363K, paused 1ms+1ms
W/dalvikvm( 1546): JNI: pin count on array 0x4147cbb0 ([B) is now 507
D/dalvikvm( 1158): GC_CONCURRENT freed 726K, 67% free 2454K/7363K, paused 5ms+2ms
D/dalvikvm( 1158): GC_CONCURRENT freed 587K, 66% free 2548K/7363K, paused 2ms+1ms
D/WifiP2pService(  993): wait for wifi sta and softap disabled!!
D/dalvikvm( 1158): GC_CONCURRENT freed 716K, 66% free 2540K/7363K, paused 3ms+9ms
D/dalvikvm( 1158): GC_CONCURRENT freed 708K, 67% free 2459K/7363K, paused 1ms+3ms
D/dalvikvm( 1158): GC_CONCURRENT freed 676K, 67% free 2462K/7363K, paused 1ms+2ms
W/dalvikvm( 1546): JNI: pin count on array 0x4147cbb0 ([B) is now 508
D/WifiP2pService(  993): wait for wifi sta and softap disabled!!
D/dalvikvm( 1158): GC_CONCURRENT freed 599K, 66% free 2536K/7363K, paused 1ms+2ms
D/MonitorCw880( 1546): counter=4 && isHeartbeatTimeout=false
W/dalvikvm( 1546): JNI: pin count on array 0x4147cbb0 ([B) is now 509
D/WifiP2pService(  993): wait for wifi sta and softap disabled!!
W/dalvikvm( 1546): JNI: pin count on array 0x4147cbb0 ([B) is now 510
D/WifiP2pService(  993): wait for wifi sta and softap disabled!!
D/MonitorCw880( 1546): counter=6 && isHeartbeatTimeout=false
W/dalvikvm( 1546): JNI: pin count on array 0x4147cbb0 ([B) is now 511
D/dalvikvm( 1158): GC_CONCURRENT freed 703K, 66% free 2528K/7363K, paused 2ms+2ms
D/WifiP2pService(  993): wait for wifi sta and softap disabled!!
D/dalvikvm( 1158): GC_CONCURRENT freed 690K, 66% free 2542K/7363K, paused 1ms+1ms
D/dalvikvm( 1158): GC_CONCURRENT freed 717K, 66% free 2529K/7363K, paused 1ms+2ms
W/dalvikvm( 1546): JNI: pin count on array 0x4147cbb0 ([B) is now 512
D/dalvikvm( 1158): GC_CONCURRENT freed 692K, 67% free 2499K/7363K, paused 28ms+1ms
D/WifiP2pService(  993): wait for wifi sta and softap disabled!!
D/MonitorCw880( 1546): counter=8 && isHeartbeatTimeout=false
D/dalvikvm( 1158): GC_CONCURRENT freed 662K, 67% free 2444K/7363K, paused 1ms+2ms
D/dalvikvm( 1158): GC_CONCURRENT freed 574K, 66% free 2514K/7363K, paused 1ms+2ms
W/dalvikvm( 1546): JNI: pin count on array 0x4147cbb0 ([B) is now 513
D/dalvikvm( 1158): GC_CONCURRENT freed 662K, 66% free 2552K/7363K, paused 2ms+2ms
D/WifiP2pService(  993): wait for wifi sta and softap disabled!!
W/dalvikvm( 1546): JNI: pin count on array 0x4147cbb0 ([B) is now 514
D/WifiP2pService(  993): wait for wifi sta and softap disabled!!
D/MonitorCw880( 1546): counter=10 && isHeartbeatTimeout=false
W/dalvikvm( 1546): JNI: pin count on array 0x4147cbb0 ([B) is now 515
D/WifiP2pService(  993): wait for wifi sta and softap disabled!!
W/dalvikvm( 1546): JNI: pin count on array 0x4147cbb0 ([B) is now 516
D/WifiP2pService(  993): wait for wifi sta and softap disabled!!
D/MonitorCw880( 1546): counter=12 && isHeartbeatTimeout=false
W/dalvikvm( 1546): JNI: pin count on array 0x4147cbb0 ([B) is now 517
D/dalvikvm(  993): GC_CONCURRENT freed 804K, 62% free 4022K/10371K, paused 3ms+7ms
D/WifiP2pService(  993): wait for wifi sta and softap disabled!!
D/dalvikvm( 1158): GC_CONCURRENT freed 729K, 68% free 2418K/7363K, paused 1ms+1ms
D/dalvikvm( 1158): GC_CONCURRENT freed 543K, 66% free 2523K/7363K, paused 1ms+1ms
D/HomePlayerLib( 1158): hostaddress count is 1
D/dalvikvm( 1158): GC_CONCURRENT freed 673K, 64% free 2692K/7363K, paused 1ms+1ms
W/dalvikvm( 1546): JNI: pin count on array 0x4147cbb0 ([B) is now 518
D/dalvikvm( 1158): GC_CONCURRENT freed 899K, 67% free 2491K/7363K, paused 1ms+1ms
D/dalvikvm( 1158): GC_CONCURRENT freed 635K, 66% free 2555K/7363K, paused 2ms+2ms
D/WifiP2pService(  993): wait for wifi sta and softap disabled!!
D/dalvikvm( 1158): GC_CONCURRENT freed 728K, 66% free 2534K/7363K, paused 2ms+1ms
D/MonitorCw880( 1546): counter=4 && isHeartbeatTimeout=false
D/dalvikvm( 1158): GC_CONCURRENT freed 702K, 66% free 2534K/7363K, paused 1ms+1ms
D/dalvikvm( 1158): GC_CONCURRENT freed 704K, 68% free 2423K/7363K, paused 2ms+1ms
W/dalvikvm( 1546): JNI: pin count on array 0x4147cbb0 ([B) is now 519
D/dalvikvm( 1158): GC_CONCURRENT freed 556K, 66% free 2528K/7363K, paused 1ms+1ms
D/WifiP2pService(  993): wait for wifi sta and softap disabled!!
W/dalvikvm( 1546): JNI: pin count on array 0x4147cbb0 ([B) is now 520
D/WifiP2pService(  993): wait for wifi sta and softap disabled!!
D/MonitorCw880( 1546): counter=6 && isHeartbeatTimeout=false
W/dalvikvm( 1546): JNI: pin count on array 0x4147cbb0 ([B) is now 521
D/WifiP2pService(  993): wait for wifi sta and softap disabled!!
W/dalvikvm( 1546): JNI: pin count on array 0x4147cbb0 ([B) is now 522
D/dalvikvm( 1158): GC_CONCURRENT freed 675K, 66% free 2528K/7363K, paused 1ms+1ms
D/WifiP2pService(  993): wait for wifi sta and softap disabled!!
D/dalvikvm( 1158): GC_CONCURRENT freed 690K, 66% free 2528K/7363K, paused 3ms+1ms
D/MonitorCw880( 1546): counter=8 && isHeartbeatTimeout=false
D/dalvikvm( 1158): GC_CONCURRENT freed 700K, 66% free 2530K/7363K, paused 1ms+1ms
W/dalvikvm( 1546): JNI: pin count on array 0x4147cbb0 ([B) is now 523
D/dalvikvm( 1158): GC_CONCURRENT freed 703K, 66% free 2528K/7363K, paused 1ms+3ms
D/WifiP2pService(  993): wait for wifi sta and softap disabled!!
D/dalvikvm( 1158): GC_CONCURRENT freed 698K, 68% free 2408K/7363K, paused 1ms+1ms
D/dalvikvm( 1158): GC_CONCURRENT freed 539K, 67% free 2470K/7363K, paused 1ms+1ms
D/dalvikvm( 1158): GC_CONCURRENT freed 620K, 66% free 2535K/7363K, paused 1ms+1ms
W/dalvikvm( 1546): JNI: pin count on array 0x4147cbb0 ([B) is now 524
D/WifiP2pService(  993): wait for wifi sta and softap disabled!!
D/dalvikvm( 1158): GC_CONCURRENT freed 704K, 66% free 2527K/7363K, paused 1ms+3ms
D/MonitorCw880( 1546): counter=10 && isHeartbeatTimeout=false
D/dalvikvm( 1158): GC_CONCURRENT freed 691K, 67% free 2484K/7363K, paused 2ms+1ms
W/dalvikvm( 1546): JNI: pin count on array 0x4147cbb0 ([B) is now 525
D/dalvikvm( 1158): GC_CONCURRENT freed 635K, 66% free 2537K/7363K, paused 1ms+2ms
D/WifiP2pService(  993): wait for wifi sta and softap disabled!!
D/dalvikvm( 1158): GC_CONCURRENT freed 705K, 66% free 2514K/7363K, paused 1ms+1ms
D/dalvikvm( 1158): GC_CONCURRENT freed 675K, 66% free 2530K/7363K, paused 1ms+2ms

W/dalvikvm( 1546): JNI: pin count on array 0x4147cbb0 ([B) is now 526
D/WifiP2pService(  993): wait for wifi sta and softap disabled!!
D/MonitorCw880( 1546): counter=12 && isHeartbeatTimeout=false
^C
130|shell@android:/ # tcpdump -s 0 port 1234
[ 2670.873402] device eth0 entered promiscuous mode
tcpdump: verbose output suppressed, use -v or -vv for full protocol decode
listening on eth0, link-type EN10MB (Ethernet), capture size 65535 bytes
20:40:09.063689 IP 192.168.2.14.1234 > 192.168.2.11.53908: P 3384413028:3384414344(1316) ack 1412006325 win 2896 <nop,nop,timestamp 667725 289058>
20:40:09.064674 IP 192.168.2.14.1234 > 192.168.2.11.53908: . 1316:2764(1448) ack 1 win 2896 <nop,nop,timestamp 667725 289058>
20:40:09.064736 IP 192.168.2.14.1234 > 192.168.2.11.53908: . 2764:4212(1448) ack 1 win 2896 <nop,nop,timestamp 667725 289058>
20:40:09.065107 IP 192.168.2.14.1234 > 192.168.2.11.53908: . 4212:5660(1448) ack 1 win 2896 <nop,nop,timestamp 667725 289058>
20:40:09.065340 IP 192.168.2.14.1234 > 192.168.2.11.53908: . 5660:7108(1448) ack 1 win 2896 <nop,nop,timestamp 667725 289058>
20:40:09.065394 IP 192.168.2.14.1234 > 192.168.2.11.53908: . 7108:8556(1448) ack 1 win 2896 <nop,nop,timestamp 667725 289058>
20:40:09.065437 IP 192.168.2.14.1234 > 192.168.2.11.53908: . 8556:10004(1448) ack 1 win 2896 <nop,nop,timestamp 667725 289058>
20:40:09.065482 IP 192.168.2.14.1234 > 192.168.2.11.53908: . 10004:11452(1448) ack 1 win 2896 <nop,nop,timestamp 667725 289058>
20:40:09.065542 IP 192.168.2.14.1234 > 192.168.2.11.53908: . 11452:12900(1448) ack 1 win 2896 <nop,nop,timestamp 667725 289058>
20:40:09.065588 IP 192.168.2.14.1234 > 192.168.2.11.53908: . 12900:14348(1448) ack 1 win 2896 <nop,nop,timestamp 667725 289058>
20:40:09.075789 IP 192.168.2.11.53908 > 192.168.2.14.1234: . ack 1316 win 3072 <nop,nop,timestamp 289062 667725>
20:40:09.076001 IP 192.168.2.14.1234 > 192.168.2.11.53908: P 14348:15792(1444) ack 1 win 2896 <nop,nop,timestamp 667728 289062>
20:40:09.078291 IP 192.168.2.11.53908 > 192.168.2.14.1234: . ack 14348 win 2872 <nop,nop,timestamp 289062 667725>
20:40:09.081071 IP 192.168.2.11.53908 > 192.168.2.14.1234: . ack 15792 win 3072 <nop,nop,timestamp 289063 667728>
20:40:09.105254 IP 192.168.2.14.1234 > 192.168.2.11.53908: P 15792:17108(1316) ack 1 win 2896 <nop,nop,timestamp 667735 289063>
20:40:09.105356 IP 192.168.2.14.1234 > 192.168.2.11.53908: . 17108:18556(1448) ack 1 win 2896 <nop,nop,timestamp 667735 289063>
20:40:09.105423 IP 192.168.2.14.1234 > 192.168.2.11.53908: . 18556:20004(1448) ack 1 win 2896 <nop,nop,timestamp 667735 289063>
20:40:09.105472 IP 192.168.2.14.1234 > 192.168.2.11.53908: . 20004:21452(1448) ack 1 win 2896 <nop,nop,timestamp 667735 289063>
20:40:09.105520 IP 192.168.2.14.1234 > 192.168.2.11.53908: . 21452:22900(1448) ack 1 win 2896 <nop,nop,timestamp 667735 289063>
20:40:09.117084 IP 192.168.2.11.53908 > 192.168.2.14.1234: . ack 17108 win 3072 <nop,nop,timestamp 289065 667735>
20:40:09.117273 IP 192.168.2.14.1234 > 192.168.2.11.53908: P 22900:23688(788) ack 1 win 2896 <nop,nop,timestamp 667738 289065>
20:40:09.120380 IP 192.168.2.11.53908 > 192.168.2.14.1234: . ack 22900 win 3004 <nop,nop,timestamp 289066 667735>
20:40:09.122242 IP 192.168.2.11.53908 > 192.168.2.14.1234: . ack 23688 win 3072 <nop,nop,timestamp 289067 667738>
20:40:09.141265 IP 192.168.2.14.1234 > 192.168.2.11.53908: P 23688:25004(1316) ack 1 win 2896 <nop,nop,timestamp 667744 289067>
20:40:09.141355 IP 192.168.2.14.1234 > 192.168.2.11.53908: . 25004:26452(1448) ack 1 win 2896 <nop,nop,timestamp 667744 289067>
20:40:09.141402 IP 192.168.2.14.1234 > 192.168.2.11.53908: . 26452:27900(1448) ack 1 win 2896 <nop,nop,timestamp 667744 289067>
20:40:09.141464 IP 192.168.2.14.1234 > 192.168.2.11.53908: . 27900:29348(1448) ack 1 win 2896 <nop,nop,timestamp 667744 289067>
20:40:09.141506 IP 192.168.2.14.1234 > 192.168.2.11.53908: . 29348:30796(1448) ack 1 win 2896 <nop,nop,timestamp 667744 289067>
20:40:09.145324 IP 192.168.2.14.1234 > 192.168.2.11.53908: . 30796:32244(1448) ack 1 win 2896 <nop,nop,timestamp 667745 289067>
20:40:09.145543 IP 192.168.2.14.1234 > 192.168.2.11.53908: . 32244:33692(1448) ack 1 win 2896 <nop,nop,timestamp 667745 289067>
20:40:09.145600 IP 192.168.2.14.1234 > 192.168.2.11.53908: . 33692:35140(1448) ack 1 win 2896 <nop,nop,timestamp 667745 289067>
20:40:09.145646 IP 192.168.2.14.1234 > 192.168.2.11.53908: . 35140:36588(1448) ack 1 win 2896 <nop,nop,timestamp 667745 289067>
20:40:09.145700 IP 192.168.2.14.1234 > 192.168.2.11.53908: . 36588:38036(1448) ack 1 win 2896 <nop,nop,timestamp 667745 289067>
20:40:09.149029 IP 192.168.2.11.53908 > 192.168.2.14.1234: . ack 25004 win 3072 <nop,nop,timestamp 289069 667744>
20:40:09.149229 IP 192.168.2.14.1234 > 192.168.2.11.53908: P 38036:39480(1444) ack 1 win 2896 <nop,nop,timestamp 667746 289069>
20:40:09.150963 IP 192.168.2.11.53908 > 192.168.2.14.1234: . ack 30796 win 2983 <nop,nop,timestamp 289070 667744>
20:40:09.152477 IP 192.168.2.11.53908 > 192.168.2.14.1234: . ack 33692 win 3030 <nop,nop,timestamp 289070 667745>
20:40:09.155578 IP 192.168.2.11.53908 > 192.168.2.14.1234: . ack 39480 win 2941 <nop,nop,timestamp 289070 667745>
20:40:09.185227 IP 192.168.2.14.1234 > 192.168.2.11.53908: P 39480:40796(1316) ack 1 win 2896 <nop,nop,timestamp 667755 289070>
20:40:09.185326 IP 192.168.2.14.1234 > 192.168.2.11.53908: . 40796:42244(1448) ack 1 win 2896 <nop,nop,timestamp 667755 289070>
20:40:09.185374 IP 192.168.2.14.1234 > 192.168.2.11.53908: . 42244:43692(1448) ack 1 win 2896 <nop,nop,timestamp 667755 289070>
20:40:09.185460 IP 192.168.2.14.1234 > 192.168.2.11.53908: . 43692:45140(1448) ack 1 win 2896 <nop,nop,timestamp 667755 289070>
20:40:09.185519 IP 192.168.2.14.1234 > 192.168.2.11.53908: . 45140:46588(1448) ack 1 win 2896 <nop,nop,timestamp 667755 289070>
20:40:09.189158 IP 192.168.2.14.1234 > 192.168.2.11.53908: . 46588:48036(1448) ack 1 win 2896 <nop,nop,timestamp 667756 289070>
20:40:09.189269 IP 192.168.2.14.1234 > 192.168.2.11.53908: . 48036:49484(1448) ack 1 win 2896 <nop,nop,timestamp 667756 289070>
20:40:09.189312 IP 192.168.2.14.1234 > 192.168.2.11.53908: . 49484:50932(1448) ack 1 win 2896 <nop,nop,timestamp 667756 289070>
20:40:09.189367 IP 192.168.2.14.1234 > 192.168.2.11.53908: . 50932:52380(1448) ack 1 win 2896 <nop,nop,timestamp 667756 289070>
20:40:09.189405 IP 192.168.2.14.1234 > 192.168.2.11.53908: . 52380:53828(1448) ack 1 win 2896 <nop,nop,timestamp 667756 289070>
20:40:09.217251 IP 192.168.2.14.1234 > 192.168.2.11.53908: . 53828:55276(1448) ack 1 win 2896 <nop,nop,timestamp 667763 289070>
20:40:09.217341 IP 192.168.2.14.1234 > 192.168.2.11.53908: . 55276:56724(1448) ack 1 win 2896 <nop,nop,timestamp 667763 289070>
20:40:09.217388 IP 192.168.2.14.1234 > 192.168.2.11.53908: . 56724:58172(1448) ack 1 win 2896 <nop,nop,timestamp 667763 289070>
20:40:09.217466 IP 192.168.2.14.1234 > 192.168.2.11.53908: . 58172:59620(1448) ack 1 win 2896 <nop,nop,timestamp 667763 289070>
20:40:09.217511 IP 192.168.2.14.1234 > 192.168.2.11.53908: . 59620:61068(1448) ack 1 win 2896 <nop,nop,timestamp 667763 289070>
20:40:09.217563 IP 192.168.2.14.1234 > 192.168.2.11.53908: . 61068:62516(1448) ack 1 win 2896 <nop,nop,timestamp 667763 289070>
20:40:09.227952 IP 192.168.2.11.53908 > 192.168.2.14.1234: . ack 40796 win 3072 <nop,nop,timestamp 289076 667755>
20:40:09.228104 IP 192.168.2.14.1234 > 192.168.2.11.53908: P 62516:63168(652) ack 1 win 2896 <nop,nop,timestamp 667766 289076>
20:40:09.228496 IP 192.168.2.11.53908 > 192.168.2.14.1234: . ack 48036 win 2962 <nop,nop,timestamp 289076 667755>
20:40:09.228504 IP 192.168.2.11.53908 > 192.168.2.14.1234: . ack 50932 win 3004 <nop,nop,timestamp 289076 667756>
20:40:09.228543 IP 192.168.2.11.53908 > 192.168.2.14.1234: . ack 53828 win 2983 <nop,nop,timestamp 289077 667756>
20:40:09.228549 IP 192.168.2.11.53908 > 192.168.2.14.1234: . ack 56724 win 3051 <nop,nop,timestamp 289077 667763>
20:40:09.229086 IP 192.168.2.14.1234 > 192.168.2.11.53908: . 63168:64616(1448) ack 1 win 2896 <nop,nop,timestamp 667766 289077>
20:40:09.229132 IP 192.168.2.14.1234 > 192.168.2.11.53908: . 64616:66064(1448) ack 1 win 2896 <nop,nop,timestamp 667766 289077>
20:40:09.229170 IP 192.168.2.14.1234 > 192.168.2.11.53908: . 66064:67512(1448) ack 1 win 2896 <nop,nop,timestamp 667766 289077>
20:40:09.229206 IP 192.168.2.14.1234 > 192.168.2.11.53908: . 67512:68960(1448) ack 1 win 2896 <nop,nop,timestamp 667766 289077>
20:40:09.229243 IP 192.168.2.11.53908 > 192.168.2.14.1234: . ack 62516 win 2962 <nop,nop,timestamp 289077 667763>
20:40:09.229292 IP 192.168.2.14.1234 > 192.168.2.11.53908: . 68960:70408(1448) ack 1 win 2896 <nop,nop,timestamp 667766 289077>
20:40:09.233599 IP 192.168.2.11.53908 > 192.168.2.14.1234: . ack 64616 win 3036 <nop,nop,timestamp 289078 667766>
20:40:09.233713 IP 192.168.2.14.1234 > 192.168.2.11.53908: P 70408:71064(656) ack 1 win 2896 <nop,nop,timestamp 667767 289078>
20:40:09.235333 IP 192.168.2.11.53908 > 192.168.2.14.1234: . ack 70408 win 2983 <nop,nop,timestamp 289078 667766>
20:40:09.239012 IP 192.168.2.11.53908 > 192.168.2.14.1234: . ack 71064 win 3072 <nop,nop,timestamp 289078 667767>
20:40:09.265394 IP 192.168.2.14.1234 > 192.168.2.11.53908: P 71064:72380(1316) ack 1 win 2896 <nop,nop,timestamp 667775 289078>
20:40:09.265475 IP 192.168.2.14.1234 > 192.168.2.11.53908: . 72380:73828(1448) ack 1 win 2896 <nop,nop,timestamp 667775 289078>
20:40:09.265522 IP 192.168.2.14.1234 > 192.168.2.11.53908: . 73828:75276(1448) ack 1 win 2896 <nop,nop,timestamp 667775 289078>
20:40:09.265593 IP 192.168.2.14.1234 > 192.168.2.11.53908: . 75276:76724(1448) ack 1 win 2896 <nop,nop,timestamp 667775 289078>
20:40:09.265649 IP 192.168.2.14.1234 > 192.168.2.11.53908: . 76724:78172(1448) ack 1 win 2896 <nop,nop,timestamp 667775 289078>
20:40:09.269160 IP 192.168.2.14.1234 > 192.168.2.11.53908: . 78172:79620(1448) ack 1 win 2896 <nop,nop,timestamp 667776 289078>
20:40:09.269288 IP 192.168.2.14.1234 > 192.168.2.11.53908: . 79620:81068(1448) ack 1 win 2896 <nop,nop,timestamp 667776 289078>
20:40:09.269357 IP 192.168.2.14.1234 > 192.168.2.11.53908: . 81068:82516(1448) ack 1 win 2896 <nop,nop,timestamp 667776 289078>
20:40:09.269405 IP 192.168.2.14.1234 > 192.168.2.11.53908: . 82516:83964(1448) ack 1 win 2896 <nop,nop,timestamp 667776 289078>
20:40:09.269462 IP 192.168.2.14.1234 > 192.168.2.11.53908: . 83964:85412(1448) ack 1 win 2896 <nop,nop,timestamp 667776 289078>
20:40:09.279461 IP 192.168.2.11.53908 > 192.168.2.14.1234: . ack 85412 win 2872 <nop,nop,timestamp 289082 667775>
20:40:09.279670 IP 192.168.2.14.1234 > 192.168.2.11.53908: P 85412:86856(1444) ack 1 win 2896 <nop,nop,timestamp 667779 289082>
20:40:09.293153 IP 192.168.2.11.53908 > 192.168.2.14.1234: . ack 86856 win 3072 <nop,nop,timestamp 289084 667779>
20:40:09.297259 IP 192.168.2.14.1234 > 192.168.2.11.53908: P 86856:88172(1316) ack 1 win 2896 <nop,nop,timestamp 667783 289084>
20:40:09.297341 IP 192.168.2.14.1234 > 192.168.2.11.53908: . 88172:89620(1448) ack 1 win 2896 <nop,nop,timestamp 667783 289084>
20:40:09.297395 IP 192.168.2.14.1234 > 192.168.2.11.53908: . 89620:91068(1448) ack 1 win 2896 <nop,nop,timestamp 667783 289084>
20:40:09.297462 IP 192.168.2.14.1234 > 192.168.2.11.53908: . 91068:92516(1448) ack 1 win 2896 <nop,nop,timestamp 667783 289084>
20:40:09.297506 IP 192.168.2.14.1234 > 192.168.2.11.53908: . 92516:93964(1448) ack 1 win 2896 <nop,nop,timestamp 667783 289084>
20:40:09.302674 IP 192.168.2.11.53908 > 192.168.2.14.1234: . ack 88172 win 3072 <nop,nop,timestamp 289085 667783>
20:40:09.302837 IP 192.168.2.14.1234 > 192.168.2.11.53908: P 93964:94752(788) ack 1 win 2896 <nop,nop,timestamp 667784 289085>
20:40:09.305581 IP 192.168.2.11.53908 > 192.168.2.14.1234: . ack 93964 win 3004 <nop,nop,timestamp 289085 667783>
20:40:09.308225 IP 192.168.2.11.53908 > 192.168.2.14.1234: . ack 94752 win 3072 <nop,nop,timestamp 289085 667784>
20:40:09.309282 IP 192.168.2.14.1234 > 192.168.2.11.53908: P 94752:96068(1316) ack 1 win 2896 <nop,nop,timestamp 667786 289085>
20:40:09.309366 IP 192.168.2.14.1234 > 192.168.2.11.53908: . 96068:97516(1448) ack 1 win 2896 <nop,nop,timestamp 667786 289085>
20:40:09.309413 IP 192.168.2.14.1234 > 192.168.2.11.53908: . 97516:98964(1448) ack 1 win 2896 <nop,nop,timestamp 667786 289085>
20:40:09.309480 IP 192.168.2.14.1234 > 192.168.2.11.53908: . 98964:100412(1448) ack 1 win 2896 <nop,nop,timestamp 667786 289085>
20:40:09.309525 IP 192.168.2.14.1234 > 192.168.2.11.53908: . 100412:101860(1448) ack 1 win 2896 <nop,nop,timestamp 667786 289085>
20:40:09.317166 IP 192.168.2.11.53908 > 192.168.2.14.1234: . ack 96068 win 3072 <nop,nop,timestamp 289086 667786>
20:40:09.317349 IP 192.168.2.14.1234 > 192.168.2.11.53908: P 101860:102648(788) ack 1 win 2896 <nop,nop,timestamp 667788 289086>
20:40:09.321788 IP 192.168.2.11.53908 > 192.168.2.14.1234: . ack 102648 win 2995 <nop,nop,timestamp 289087 667786>
20:40:09.345193 IP 192.168.2.14.1234 > 192.168.2.11.53908: P 102648:103964(1316) ack 1 win 2896 <nop,nop,timestamp 667795 289087>
20:40:09.345287 IP 192.168.2.14.1234 > 192.168.2.11.53908: . 103964:105412(1448) ack 1 win 2896 <nop,nop,timestamp 667795 289087>
20:40:09.345327 IP 192.168.2.14.1234 > 192.168.2.11.53908: . 105412:106860(1448) ack 1 win 2896 <nop,nop,timestamp 667795 289087>
20:40:09.345378 IP 192.168.2.14.1234 > 192.168.2.11.53908: . 106860:108308(1448) ack 1 win 2896 <nop,nop,timestamp 667795 289087>
20:40:09.345415 IP 192.168.2.14.1234 > 192.168.2.11.53908: . 108308:109756(1448) ack 1 win 2896 <nop,nop,timestamp 667795 289087>
20:40:09.348678 IP 192.168.2.11.53908 > 192.168.2.14.1234: . ack 103964 win 3072 <nop,nop,timestamp 289089 667795>
20:40:09.348808 IP 192.168.2.14.1234 > 192.168.2.11.53908: P 109756:110544(788) ack 1 win 2896 <nop,nop,timestamp 667796 289089>
20:40:09.352627 IP 192.168.2.11.53908 > 192.168.2.14.1234: . ack 109756 win 3004 <nop,nop,timestamp 289090 667795>
20:40:09.352636 IP 192.168.2.11.53908 > 192.168.2.14.1234: . ack 110544 win 3072 <nop,nop,timestamp 289090 667796>
20:40:09.369137 IP 192.168.2.14.1234 > 192.168.2.11.53908: P 110544:111860(1316) ack 1 win 2896 <nop,nop,timestamp 667801 289090>
20:40:09.369215 IP 192.168.2.14.1234 > 192.168.2.11.53908: . 111860:113308(1448) ack 1 win 2896 <nop,nop,timestamp 667801 289090>
20:40:09.369256 IP 192.168.2.14.1234 > 192.168.2.11.53908: . 113308:114756(1448) ack 1 win 2896 <nop,nop,timestamp 667801 289090>
20:40:09.369310 IP 192.168.2.14.1234 > 192.168.2.11.53908: . 114756:116204(1448) ack 1 win 2896 <nop,nop,timestamp 667801 289090>
20:40:09.369363 IP 192.168.2.14.1234 > 192.168.2.11.53908: . 116204:117652(1448) ack 1 win 2896 <nop,nop,timestamp 667801 289090>
20:40:09.376108 IP 192.168.2.11.53908 > 192.168.2.14.1234: . ack 111860 win 3072 <nop,nop,timestamp 289092 667801>
20:40:09.376265 IP 192.168.2.14.1234 > 192.168.2.11.53908: P 117652:118440(788) ack 1 win 2896 <nop,nop,timestamp 667803 289092>
20:40:09.376115 IP 192.168.2.11.53908 > 192.168.2.14.1234: . ack 117652 win 2983 <nop,nop,timestamp 289092 667801>
20:40:09.381139 IP 192.168.2.11.53908 > 192.168.2.14.1234: . ack 118440 win 3072 <nop,nop,timestamp 289092 667803>
20:40:09.381312 IP 192.168.2.14.1234 > 192.168.2.11.53908: P 118440:119756(1316) ack 1 win 2896 <nop,nop,timestamp 667804 289092>
20:40:09.381373 IP 192.168.2.14.1234 > 192.168.2.11.53908: . 119756:121204(1448) ack 1 win 2896 <nop,nop,timestamp 667804 289092>
20:40:09.388557 IP 192.168.2.11.53908 > 192.168.2.14.1234: . ack 119756 win 3072 <nop,nop,timestamp 289093 667804>
20:40:09.388565 IP 192.168.2.11.53908 > 192.168.2.14.1234: . ack 125548 win 2983 <nop,nop,timestamp 289093 667804>
20:40:09.402963 IP 192.168.2.11.53908 > 192.168.2.14.1234: . ack 126336 win 3072 <nop,nop,timestamp 289095 667806>
20:40:09.405164 IP 192.168.2.11.53908 > 192.168.2.14.1234: . ack 133576 win 2962 <nop,nop,timestamp 289095 667807>
20:40:09.406634 IP 192.168.2.11.53908 > 192.168.2.14.1234: . ack 134232 win 3072 <nop,nop,timestamp 289095 667810>
20:40:09.432923 IP 192.168.2.11.53908 > 192.168.2.14.1234: . ack 135548 win 3072 <nop,nop,timestamp 289098 667816>
20:40:09.545116 IP 192.168.2.14.1234 > 192.168.2.11.53908: P 173712:175028(1316) ack 1 win 2896 <nop,nop,timestamp 667845 289106>
20:40:09.545188 IP 192.168.2.14.1234 > 192.168.2.11.53908: . 175028:176476(1448) ack 1 win 2896 <nop,nop,timestamp 667845 289106>
20:40:09.545226 IP 192.168.2.14.1234 > 192.168.2.11.53908: . 176476:177924(1448) ack 1 win 2896 <nop,nop,timestamp 667845 289106>
20:40:09.545279 IP 192.168.2.14.1234 > 192.168.2.11.53908: . 177924:179372(1448) ack 1 win 2896 <nop,nop,timestamp 667845 289106>
20:40:09.545320 IP 192.168.2.14.1234 > 192.168.2.11.53908: . 179372:180820(1448) ack 1 win 2896 <nop,nop,timestamp 667845 289106>
20:40:09.549050 IP 192.168.2.14.1234 > 192.168.2.11.53908: . 180820:182268(1448) ack 1 win 2896 <nop,nop,timestamp 667846 289106>
20:40:09.549109 IP 192.168.2.14.1234 > 192.168.2.11.53908: . 182268:183716(1448) ack 1 win 2896 <nop,nop,timestamp 667846 289106>
20:40:09.549149 IP 192.168.2.14.1234 > 192.168.2.11.53908: . 183716:185164(1448) ack 1 win 2896 <nop,nop,timestamp 667846 289106>
20:40:09.549182 IP 192.168.2.11.53908 > 192.168.2.14.1234: . ack 175028 win 3072 <nop,nop,timestamp 289109 667845>
20:40:09.549261 IP 192.168.2.14.1234 > 192.168.2.11.53908: . 185164:186612(1448) ack 1 win 2896 <nop,nop,timestamp 667846 289106>
20:40:09.549313 IP 192.168.2.14.1234 > 192.168.2.11.53908: P 186612:186872(260) ack 1 win 2896 <nop,nop,timestamp 667846 289109>
20:40:09.549369 IP 192.168.2.14.1234 > 192.168.2.11.53908: . 186872:188320(1448) ack 1 win 2896 <nop,nop,timestamp 667846 289109>
20:40:09.555929 IP 192.168.2.11.53908 > 192.168.2.14.1234: . ack 182268 win 2962 <nop,nop,timestamp 289110 667845>
20:40:09.560571 IP 192.168.2.11.53908 > 192.168.2.14.1234: . ack 185164 win 3051 <nop,nop,timestamp 289111 667846>
20:40:09.566908 IP 192.168.2.11.53908 > 192.168.2.14.1234: . ack 188320 win 3002 <nop,nop,timestamp 289111 667846>
20:40:09.567085 IP 192.168.2.14.1234 > 192.168.2.11.53908: P 188320:189504(1184) ack 1 win 2896 <nop,nop,timestamp 667850 289111>
20:40:09.573295 IP 192.168.2.11.53908 > 192.168.2.14.1234: . ack 189504 win 3072 <nop,nop,timestamp 289112 667850>
20:40:09.589191 IP 192.168.2.14.1234 > 192.168.2.11.53908: P 189504:190820(1316) ack 1 win 2896 <nop,nop,timestamp 667856 289112>
20:40:09.589262 IP 192.168.2.14.1234 > 192.168.2.11.53908: . 190820:192268(1448) ack 1 win 2896 <nop,nop,timestamp 667856 289112>
20:40:09.589301 IP 192.168.2.14.1234 > 192.168.2.11.53908: . 192268:193716(1448) ack 1 win 2896 <nop,nop,timestamp 667856 289112>
20:40:09.589355 IP 192.168.2.14.1234 > 192.168.2.11.53908: . 193716:195164(1448) ack 1 win 2896 <nop,nop,timestamp 667856 289112>
20:40:09.589394 IP 192.168.2.14.1234 > 192.168.2.11.53908: . 195164:196612(1448) ack 1 win 2896 <nop,nop,timestamp 667856 289112>
20:40:09.605045 IP 192.168.2.11.53908 > 192.168.2.14.1234: . ack 190820 win 3072 <nop,nop,timestamp 289115 667856>
20:40:09.605211 IP 192.168.2.14.1234 > 192.168.2.11.53908: P 196612:197400(788) ack 1 win 2896 <nop,nop,timestamp 667860 289115>
20:40:09.607631 IP 192.168.2.11.53908 > 192.168.2.14.1234: . ack 196612 win 3004 <nop,nop,timestamp 289115 667856>
20:40:09.610650 IP 192.168.2.11.53908 > 192.168.2.14.1234: . ack 197400 win 3072 <nop,nop,timestamp 289116 667860>
20:40:09.613028 IP 192.168.2.14.1234 > 192.168.2.11.53908: P 197400:198716(1316) ack 1 win 2896 <nop,nop,timestamp 667862 289116>
20:40:09.613084 IP 192.168.2.14.1234 > 192.168.2.11.53908: . 198716:200164(1448) ack 1 win 2896 <nop,nop,timestamp 667862 289116>
20:40:09.613122 IP 192.168.2.14.1234 > 192.168.2.11.53908: . 200164:201612(1448) ack 1 win 2896 <nop,nop,timestamp 667862 289116>
20:40:09.613171 IP 192.168.2.14.1234 > 192.168.2.11.53908: . 201612:203060(1448) ack 1 win 2896 <nop,nop,timestamp 667862 289116>
20:40:09.616901 IP 192.168.2.11.53908 > 192.168.2.14.1234: . ack 198716 win 3072 <nop,nop,timestamp 289116 667862>
20:40:09.861163 IP 192.168.2.14.1234 > 192.168.2.11.53908: P 300048:301364(1316) ack 1 win 2896 <nop,nop,timestamp 667924 289138>
20:40:09.861258 IP 192.168.2.14.1234 > 192.168.2.11.53908: . 301364:302812(1448) ack 1 win 2896 <nop,nop,timestamp 667924 289138>
20:40:09.861319 IP 192.168.2.14.1234 > 192.168.2.11.53908: . 302812:304260(1448) ack 1 win 2896 <nop,nop,timestamp 667924 289138>
20:40:09.861369 IP 192.168.2.14.1234 > 192.168.2.11.53908: . 304260:305708(1448) ack 1 win 2896 <nop,nop,timestamp 667924 289138>
20:40:09.861415 IP 192.168.2.14.1234 > 192.168.2.11.53908: . 305708:307156(1448) ack 1 win 2896 <nop,nop,timestamp 667924 289138>
20:40:09.865309 IP 192.168.2.14.1234 > 192.168.2.11.53908: . 307156:308604(1448) ack 1 win 2896 <nop,nop,timestamp 667925 289138>
20:40:09.865387 IP 192.168.2.14.1234 > 192.168.2.11.53908: . 308604:310052(1448) ack 1 win 2896 <nop,nop,timestamp 667925 289138>
20:40:09.865437 IP 192.168.2.14.1234 > 192.168.2.11.53908: . 310052:311500(1448) ack 1 win 2896 <nop,nop,timestamp 667925 289138>
20:40:09.865501 IP 192.168.2.14.1234 > 192.168.2.11.53908: . 311500:312948(1448) ack 1 win 2896 <nop,nop,timestamp 667925 289138>
20:40:09.865547 IP 192.168.2.14.1234 > 192.168.2.11.53908: . 312948:314396(1448) ack 1 win 2896 <nop,nop,timestamp 667925 289138>
20:40:09.867813 IP 192.168.2.11.53908 > 192.168.2.14.1234: . ack 301364 win 3072 <nop,nop,timestamp 289141 667924>
20:40:09.867907 IP 192.168.2.14.1234 > 192.168.2.11.53908: P 314396:315840(1444) ack 1 win 2896 <nop,nop,timestamp 667926 289141>
20:40:09.871043 IP 192.168.2.11.53908 > 192.168.2.14.1234: . ack 304260 win 3051 <nop,nop,timestamp 289142 667924>
20:40:09.871050 IP 192.168.2.11.53908 > 192.168.2.14.1234: . ack 310052 win 2983 <nop,nop,timestamp 289142 667924>
20:40:09.872938 IP 192.168.2.11.53908 > 192.168.2.14.1234: . ack 312948 win 3030 <nop,nop,timestamp 289142 667925>
20:40:09.872945 IP 192.168.2.11.53908 > 192.168.2.14.1234: . ack 315840 win 2985 <nop,nop,timestamp 289142 667925>
20:40:09.905107 IP 192.168.2.14.1234 > 192.168.2.11.53908: P 315840:317156(1316) ack 1 win 2896 <nop,nop,timestamp 667935 289142>
20:40:09.905180 IP 192.168.2.14.1234 > 192.168.2.11.53908: . 317156:318604(1448) ack 1 win 2896 <nop,nop,timestamp 667935 289142>
20:40:09.905221 IP 192.168.2.14.1234 > 192.168.2.11.53908: . 318604:320052(1448) ack 1 win 2896 <nop,nop,timestamp 667935 289142>
20:40:09.905294 IP 192.168.2.14.1234 > 192.168.2.11.53908: . 320052:321500(1448) ack 1 win 2896 <nop,nop,timestamp 667935 289142>
20:40:09.905340 IP 192.168.2.14.1234 > 192.168.2.11.53908: . 321500:322948(1448) ack 1 win 2896 <nop,nop,timestamp 667935 289142>
20:40:09.909031 IP 192.168.2.14.1234 > 192.168.2.11.53908: . 322948:324396(1448) ack 1 win 2896 <nop,nop,timestamp 667936 289142>
20:40:09.909085 IP 192.168.2.14.1234 > 192.168.2.11.53908: . 324396:325844(1448) ack 1 win 2896 <nop,nop,timestamp 667936 289142>
20:40:09.909122 IP 192.168.2.14.1234 > 192.168.2.11.53908: . 325844:327292(1448) ack 1 win 2896 <nop,nop,timestamp 667936 289142>
20:40:09.909159 IP 192.168.2.14.1234 > 192.168.2.11.53908: . 327292:328740(1448) ack 1 win 2896 <nop,nop,timestamp 667936 289142>
20:40:09.909213 IP 192.168.2.14.1234 > 192.168.2.11.53908: . 328740:330188(1448) ack 1 win 2896 <nop,nop,timestamp 667936 289142>
20:40:09.911478 IP 192.168.2.11.53908 > 192.168.2.14.1234: . ack 317156 win 3072 <nop,nop,timestamp 289145 667935>
20:40:09.911573 IP 192.168.2.14.1234 > 192.168.2.11.53908: P 330188:331632(1444) ack 1 win 2896 <nop,nop,timestamp 667937 289145>
20:40:09.913342 IP 192.168.2.11.53908 > 192.168.2.14.1234: . ack 322948 win 2983 <nop,nop,timestamp 289146 667935>
20:40:09.916546 IP 192.168.2.11.53908 > 192.168.2.14.1234: . ack 325844 win 3051 <nop,nop,timestamp 289146 667936>
20:40:09.920847 IP 192.168.2.11.53908 > 192.168.2.14.1234: . ack 330188 win 2984 <nop,nop,timestamp 289146 667936>
20:40:09.920856 IP 192.168.2.11.53908 > 192.168.2.14.1234: . ack 331632 win 3072 <nop,nop,timestamp 289146 667937>
20:40:09.953505 IP 192.168.2.11.53908 > 192.168.2.14.1234: . ack 332948 win 3072 <nop,nop,timestamp 289150 667946>
20:40:09.955229 IP 192.168.2.11.53908 > 192.168.2.14.1234: . ack 335844 win 3030 <nop,nop,timestamp 289150 667946>
20:40:09.955239 IP 192.168.2.11.53908 > 192.168.2.14.1234: . ack 338740 win 3004 <nop,nop,timestamp 289150 667946>
20:40:09.957341 IP 192.168.2.11.53908 > 192.168.2.14.1234: . ack 339528 win 3072 <nop,nop,timestamp 289150 667947>
20:40:09.987107 IP 192.168.2.11.53908 > 192.168.2.14.1234: . ack 340844 win 3072 <nop,nop,timestamp 289153 667952>
20:40:10.193860 IP 192.168.2.11.53908 > 192.168.2.14.1234: . ack 417700 win 2983 <nop,nop,timestamp 289174 668004>
20:40:10.208863 IP 192.168.2.11.53908 > 192.168.2.14.1234: . ack 420596 win 3051 <nop,nop,timestamp 289175 668005>
20:40:10.208870 IP 192.168.2.11.53908 > 192.168.2.14.1234: . ack 423492 win 3031 <nop,nop,timestamp 289175 668005>
20:40:10.210104 IP 192.168.2.11.53908 > 192.168.2.14.1234: . ack 426384 win 3004 <nop,nop,timestamp 289175 668005>
20:40:10.225317 IP 192.168.2.14.1234 > 192.168.2.11.53908: P 426384:427700(1316) ack 1 win 2896 <nop,nop,timestamp 668015 289175>
20:40:10.225422 IP 192.168.2.14.1234 > 192.168.2.11.53908: . 427700:429148(1448) ack 1 win 2896 <nop,nop,timestamp 668015 289175>
20:40:10.225500 IP 192.168.2.14.1234 > 192.168.2.11.53908: . 429148:430596(1448) ack 1 win 2896 <nop,nop,timestamp 668015 289175>
20:40:10.225551 IP 192.168.2.14.1234 > 192.168.2.11.53908: . 430596:432044(1448) ack 1 win 2896 <nop,nop,timestamp 668015 289175>
20:40:10.225607 IP 192.168.2.14.1234 > 192.168.2.11.53908: . 432044:433492(1448) ack 1 win 2896 <nop,nop,timestamp 668015 289175>
20:40:10.229102 IP 192.168.2.14.1234 > 192.168.2.11.53908: . 433492:434940(1448) ack 1 win 2896 <nop,nop,timestamp 668016 289175>
20:40:10.229168 IP 192.168.2.14.1234 > 192.168.2.11.53908: . 434940:436388(1448) ack 1 win 2896 <nop,nop,timestamp 668016 289175>
20:40:10.229208 IP 192.168.2.14.1234 > 192.168.2.11.53908: . 436388:437836(1448) ack 1 win 2896 <nop,nop,timestamp 668016 289175>
20:40:10.229247 IP 192.168.2.14.1234 > 192.168.2.11.53908: . 437836:439284(1448) ack 1 win 2896 <nop,nop,timestamp 668016 289175>
20:40:10.229297 IP 192.168.2.14.1234 > 192.168.2.11.53908: . 439284:440732(1448) ack 1 win 2896 <nop,nop,timestamp 668016 289175>
20:40:10.231372 IP 192.168.2.11.53908 > 192.168.2.14.1234: . ack 427700 win 3072 <nop,nop,timestamp 289178 668015>
20:40:10.231481 IP 192.168.2.14.1234 > 192.168.2.11.53908: P 440732:442176(1444) ack 1 win 2896 <nop,nop,timestamp 668017 289178>
20:40:10.233212 IP 192.168.2.11.53908 > 192.168.2.14.1234: . ack 433492 win 2983 <nop,nop,timestamp 289178 668015>
20:40:10.239260 IP 192.168.2.11.53908 > 192.168.2.14.1234: . ack 436388 win 3051 <nop,nop,timestamp 289178 668016>
20:40:10.241256 IP 192.168.2.11.53908 > 192.168.2.14.1234: . ack 440732 win 3031 <nop,nop,timestamp 289178 668016>
20:40:10.241263 IP 192.168.2.11.53908 > 192.168.2.14.1234: . ack 442176 win 3072 <nop,nop,timestamp 289179 668017>
20:40:10.269091 IP 192.168.2.14.1234 > 192.168.2.11.53908: P 442176:443492(1316) ack 1 win 2896 <nop,nop,timestamp 668026 289179>
20:40:10.269160 IP 192.168.2.14.1234 > 192.168.2.11.53908: . 443492:444940(1448) ack 1 win 2896 <nop,nop,timestamp 668026 289179>
20:40:10.269200 IP 192.168.2.14.1234 > 192.168.2.11.53908: . 444940:446388(1448) ack 1 win 2896 <nop,nop,timestamp 668026 289179>
20:40:10.269256 IP 192.168.2.14.1234 > 192.168.2.11.53908: . 446388:447836(1448) ack 1 win 2896 <nop,nop,timestamp 668026 289179>
20:40:10.269296 IP 192.168.2.14.1234 > 192.168.2.11.53908: . 447836:449284(1448) ack 1 win 2896 <nop,nop,timestamp 668026 289179>
20:40:10.279252 IP 192.168.2.11.53908 > 192.168.2.14.1234: . ack 443492 win 3072 <nop,nop,timestamp 289182 668026>
20:40:10.279429 IP 192.168.2.14.1234 > 192.168.2.11.53908: P 449284:450072(788) ack 1 win 2896 <nop,nop,timestamp 668029 289182>
20:40:10.282065 IP 192.168.2.11.53908 > 192.168.2.14.1234: . ack 449284 win 2983 <nop,nop,timestamp 289183 668026>
20:40:10.282074 IP 192.168.2.11.53908 > 192.168.2.14.1234: . ack 450072 win 3072 <nop,nop,timestamp 289183 668029>
20:40:10.293177 IP 192.168.2.14.1234 > 192.168.2.11.53908: P 450072:451388(1316) ack 1 win 2896 <nop,nop,timestamp 668032 289183>
20:40:10.293601 IP 192.168.2.14.1234 > 192.168.2.11.53908: . 451388:452836(1448) ack 1 win 2896 <nop,nop,timestamp 668032 289183>
20:40:10.526117 IP 192.168.2.11.53908 > 192.168.2.14.1234: . ack 544824 win 3072 <nop,nop,timestamp 289207 668089>
20:40:10.537061 IP 192.168.2.14.1234 > 192.168.2.11.53908: P 544824:546140(1316) ack 1 win 2896 <nop,nop,timestamp 668093 289207>
